{
  "$schema": "./schema.json",
  "id": "sven-co-op",
  "name": "Sven Co-op",
  "serverAppId": 276060,
  "gameAppId": 225840,
  "anonymous": true,
  "tier": "full",
  "settings": [
    {
      "key": "serverName",
      "label": "Server name",
      "type": "text",
      "default": "NeledPort Sven Co-op"
    },
    {
      "key": "map",
      "label": "Start map",
      "type": "text",
      "default": "svencoop1"
    },
    {
      "key": "maxPlayers",
      "label": "Max players",
      "type": "number",
      "default": 16
    }
  ],
  "configAdapter": "source",
  "platforms": {
    "linux": {
      "executable": "svends_run",
      "args": [
        "-game",
        "svencoop",
        "-strictportbind",
        "+ip",
        "0.0.0.0",
        "-port",
        "{port:game}",
        "+clientport",
        "{port:client}",
        "+map",
        "{setting:map}",
        "+servercfgfile",
        "neledport.cfg",
        "+maxplayers",
        "{setting:maxPlayers}",
        "-norestart",
        "+exec",
        "banned.cfg"
      ],
      "configFiles": [
        {
          "path": "svencoop/neledport.cfg",
          "format": "cfg"
        }
      ]
    },
    "windows": {
      "executable": "svends.exe",
      "args": [
        "-console",
        "-game",
        "svencoop",
        "-strictportbind",
        "+ip",
        "0.0.0.0",
        "-port",
        "{port:game}",
        "+clientport",
        "{port:client}",
        "+map",
        "{setting:map}",
        "+servercfgfile",
        "neledport.cfg",
        "+maxplayers",
        "{setting:maxPlayers}",
        "+exec",
        "banned.cfg"
      ],
      "configFiles": [
        {
          "path": "svencoop/neledport.cfg",
          "format": "cfg"
        }
      ]
    }
  },
  "ports": [
    {
      "name": "game",
      "default": 27015,
      "protocol": "udp"
    },
    {
      "name": "client",
      "default": 27005,
      "protocol": "udp"
    }
  ],
  "control": {
    "type": "goldsrc",
    "port": "game",
    "shutdown": "quit"
  },
  "players": {
    "source": "rcon"
  },
  "bans": {
    "method": "rcon",
    "file": "svencoop/banned.cfg",
    "format": "source-cfg"
  }
}
