{
  "$schema": "./schema.json",
  "id": "sourceforts-classic",
  "name": "SourceForts Classic",
  "serverAppId": 244310,
  "anonymous": true,
  "tier": "basic",
  "settings": [
    {
      "key": "maxPlayers",
      "label": "Max players",
      "type": "number",
      "default": 32
    }
  ],
  "platforms": {
    "linux": {
      "executable": "srcds_run",
      "args": [
        "-game",
        "sfclassic",
        "-strictportbind",
        "-ip",
        "0.0.0.0",
        "-port",
        "{port:game}",
        "+clientport",
        "{port:client}",
        "+tv_port",
        "{port:sourcetv}",
        "+map",
        "sf_astrodome",
        "+servercfgfile",
        "neledport.cfg",
        "-maxplayers",
        "{setting:maxPlayers}"
      ]
    }
  },
  "ports": [
    {
      "name": "game",
      "default": 27015,
      "protocol": "udp"
    },
    {
      "name": "client",
      "default": 27005,
      "protocol": "udp"
    },
    {
      "name": "sourcetv",
      "default": 27020,
      "protocol": "udp"
    }
  ],
  "control": {
    "type": "signal"
  },
  "players": {
    "source": "a2s",
    "port": "game"
  }
}
