{
  "$schema": "./schema.json",
  "id": "counter-strike-condition-zero",
  "name": "Counter-Strike: Condition Zero",
  "serverAppId": 90,
  "gameAppId": 80,
  "anonymous": true,
  "steamMod": "czero",
  "tier": "full",
  "settings": [
    {
      "key": "serverName",
      "label": "Server name",
      "type": "text",
      "default": "NeledPort Counter-Strike: Condition Zero"
    },
    {
      "key": "map",
      "label": "Start map",
      "type": "text",
      "default": "de_dust2"
    },
    {
      "key": "maxPlayers",
      "label": "Max players",
      "type": "number",
      "default": 16
    }
  ],
  "configAdapter": "source",
  "platforms": {
    "linux": {
      "executable": "hlds_run",
      "args": [
        "-game",
        "czero",
        "-strictportbind",
        "+ip",
        "0.0.0.0",
        "-port",
        "{port:game}",
        "+clientport",
        "{port:client}",
        "+map",
        "{setting:map}",
        "+servercfgfile",
        "neledport.cfg",
        "-maxplayers",
        "{setting:maxPlayers}",
        "-norestart",
        "+exec",
        "banned.cfg"
      ],
      "configFiles": [
        {
          "path": "czero/neledport.cfg",
          "format": "cfg"
        }
      ]
    },
    "windows": {
      "executable": "hlds.exe",
      "args": [
        "-console",
        "-game",
        "czero",
        "-strictportbind",
        "+ip",
        "0.0.0.0",
        "-port",
        "{port:game}",
        "+clientport",
        "{port:client}",
        "+map",
        "{setting:map}",
        "+servercfgfile",
        "neledport.cfg",
        "-maxplayers",
        "{setting:maxPlayers}",
        "+exec",
        "banned.cfg"
      ],
      "configFiles": [
        {
          "path": "czero/neledport.cfg",
          "format": "cfg"
        }
      ]
    }
  },
  "ports": [
    {
      "name": "game",
      "default": 27015,
      "protocol": "udp"
    },
    {
      "name": "client",
      "default": 27005,
      "protocol": "udp"
    }
  ],
  "control": {
    "type": "goldsrc",
    "port": "game",
    "shutdown": "quit"
  },
  "players": {
    "source": "rcon"
  },
  "bans": {
    "method": "rcon",
    "file": "czero/banned.cfg",
    "format": "source-cfg"
  }
}
